Results/paper_grouped_results/03_model_regularization_no_presmoothing/nonlinear_no_noise.csv

experiment,dataset,method,original_rows,training_rows,chop_grid_s,chop_grid_T,max_rows_per_cell,smoothing_type,smoothing_strength,model_regularization_type,model_regularization_strength,test_obs_q_RMSE,clean_q_RMSE,clean_dq_ds_RMSE,clean_dq_dT_RMSE,test_obs_q_RMSE/noise,clean_dq_ds_RMSE/noise,clean_dq_dT_RMSE/noise,entropy_violation_%,worst_entropy_violation,deriv_violation_%,worst_deriv_violation,status,build_s,newton_steps,flux_calls,final_residual,rel_solution_err,solve_total_s,flux_eval_s,nonflux_s,avg_flux_eval_us
model_regularization_sweep_no_presmoothing,nonlinear_no_noise,ridge_rff+ridge=1e-6,3000,289,17,17,1,none,0.0,ridge,1e-06,0.003982494179148629,0.0026845207061135874,0.02006296274189294,0.02568634062796056,,,,0.0,0.0,0.0,0.0,ok,0.09731109999120235,4.0,720,3.7724064905822456e-14,5.14167551914718e-05,0.15934469999046996,0.1278756000683643,0.03146909992210567,177.6050000949504
model_regularization_sweep_no_presmoothing,nonlinear_no_noise,ridge_rff+ridge=1e-4,3000,289,17,17,1,none,0.0,ridge,0.0001,0.016302639360688917,0.014068948161553593,0.1035512915056744,0.09777288658846664,,,,0.0,0.0,0.0,0.0,ok,0.09219329999177717,4.0,720,4.970030894746323e-14,0.000819999528024578,0.15919949999079108,0.12753130093915388,0.0316681990516372,177.12680685993595
model_regularization_sweep_no_presmoothing,nonlinear_no_noise,ridge_rff+ridge=1e-2,3000,289,17,17,1,none,0.0,ridge,0.01,0.09106216457841322,0.0919823483949216,0.5627735051031434,0.4391507316589826,,,,0.0,0.0,0.0,0.0,ok,0.08659170000464655,4.0,720,5.155166129307994e-13,0.0031085660698742046,0.1587747000157833,0.12772819981910288,0.031046500196680427,177.4002775265318
model_regularization_sweep_no_presmoothing,nonlinear_no_noise,ridge_rff+ridge=1e-1,3000,289,17,17,1,none,0.0,ridge,0.1,0.21325304713119553,0.2136761247168696,1.1278706500986986,1.0370545626446226,,,,0.6,0.000981848833915343,0.0,0.0,ok,0.07870109999203123,4.0,720,3.390527324964834e-14,0.005521437030315959,0.15795339999021962,0.12679530036984943,0.031158099620370194,176.1045838470131
model_regularization_sweep_no_presmoothing,nonlinear_no_noise,penalty_rff+ridge=1e-6,3000,289,17,17,1,none,0.0,ridge,1e-06,0.0023695436516108343,0.0019014911848046737,0.014756216933978392,0.012705164274600778,,,,0.0,0.0,0.0,0.0,ok,0.39584429998649284,4.0,720,5.201344513157593e-14,8.385595318935011e-05,0.11403799999970943,0.08345729977008887,0.03058070022962056,115.91291634734564
model_regularization_sweep_no_presmoothing,nonlinear_no_noise,penalty_rff+ridge=1e-4,3000,289,17,17,1,none,0.0,ridge,0.0001,0.01166365806652433,0.011401456178775372,0.07531803939390537,0.07118969057268831,,,,0.0,0.0,0.0,0.0,ok,0.4650053000077605,4.0,720,4.59691325767714e-14,0.0007064833370830749,0.11389639999833889,0.08317770023131743,0.030718699767021462,115.52458365460754
model_regularization_sweep_no_presmoothing,nonlinear_no_noise,penalty_rff+ridge=1e-2,3000,289,17,17,1,none,0.0,ridge,0.01,0.06989059124971177,0.07251161564301808,0.4163729032779123,0.3494935011798803,,,,0.0,0.0,0.0,0.0,ok,0.4744300000020303,4.0,720,6.083049639091778e-14,0.0021099757446856994,0.11417039998923428,0.0837605994020123,0.03040980058722198,116.3341658361282
model_regularization_sweep_no_presmoothing,nonlinear_no_noise,penalty_rff+ridge=1e-1,3000,289,17,17,1,none,0.0,ridge,0.1,0.2221746483574567,0.2373928216336569,0.9409074578525515,0.8653320411664053,,,,0.0,0.0,0.0,0.0,ok,0.5057705999934115,4.0,720,3.477816819399947e-14,0.009834612173848253,0.11295830001472495,0.08255969986203127,0.03039860015269369,114.66624980837676
model_regularization_sweep_no_presmoothing,nonlinear_no_noise,kissgp+ridge=1e-6,3000,289,17,17,1,none,0.0,ridge,1e-06,0.3126880165426842,0.3343670474740624,1.0137239219774676,0.8942991248717023,,,,0.0,0.0,0.0,0.0,ok,0.35321079997811466,4.0,720,4.130984571769004e-14,0.022230728116663562,2.2181946999917272,2.161408599524293,0.05678610046743415,3001.956388228185
model_regularization_sweep_no_presmoothing,nonlinear_no_noise,kissgp+ridge=1e-4,3000,289,17,17,1,none,0.0,ridge,0.0001,0.3125686740538329,0.33417848026080127,1.0148930722687743,0.8945008850242662,,,,0.0,0.0,0.0,0.0,ok,0.37506809999467805,4.0,720,4.511168274675536e-14,0.022288170728417156,2.297021100006532,2.240835899981903,0.05618520002462901,3112.2720833081985
model_regularization_sweep_no_presmoothing,nonlinear_no_noise,kissgp+ridge=1e-2,3000,289,17,17,1,none,0.0,ridge,0.01,0.3555950718589083,0.37834458790033676,1.2836406518227037,1.0206806163738829,,,,0.0,0.0,0.0,0.0,ok,0.3820599000027869,4.0,720,5.075844477968001e-14,0.025026560160568437,2.3528768999967724,2.2958798999898136,0.05699700000695884,3188.7220833191855
model_regularization_sweep_no_presmoothing,nonlinear_no_noise,kissgp+ridge=1e-1,3000,289,17,17,1,none,0.0,ridge,0.1,0.37436695557825544,0.3849402100553394,1.5614345928095281,1.3725626692553687,,,,0.0,0.0,0.0,0.0,ok,0.40150109998648986,4.0,720,4.7569396744403564e-14,0.011916538326509407,2.3859893000044394,2.3277457006042823,0.05824359940015711,3232.98013972817
model_regularization_sweep_no_presmoothing,nonlinear_no_noise,rbf+ridge=1e-6,3000,289,17,17,1,none,0.0,ridge,1e-06,2.7493780461333106,2.6983647560183988,5.041970813652425,9.167606401430444,,,,25.0,2.6888262239657124,27.6,6.862823719103022,failed: ZeroDivisionError,0.0727193999919109,,8240,,,0.49758990001282655,0.18741860348382033,0.3101712965290062,22.74497615094907
model_regularization_sweep_no_presmoothing,nonlinear_no_noise,rbf+ridge=1e-4,3000,289,17,17,1,none,0.0,ridge,0.0001,2.7499022910342013,2.6988536286209395,5.041612190926096,9.170620023842908,,,,25.0,2.690128092365113,27.6,6.861978832767865,failed: ZeroDivisionError,0.07013399997958913,,7600,,,0.4533762999926694,0.1690301006019581,0.28434619939071126,22.240802710783964
model_regularization_sweep_no_presmoothing,nonlinear_no_noise,rbf+ridge=1e-2,3000,289,17,17,1,none,0.0,ridge,0.01,2.806248480922734,2.751743422029608,5.007935993778994,9.489104472399577,,,,25.2,2.8243186231434576,27.200000000000003,6.785883361849825,failed: ZeroDivisionError,0.06871620001038536,,7920,,,0.46154780001961626,0.17220650039962493,0.28934129961999133,21.743244999952644
model_regularization_sweep_no_presmoothing,nonlinear_no_noise,rbf+ridge=1e-1,3000,289,17,17,1,none,0.0,ridge,0.1,3.8177999103956584,3.738246462145902,4.9335234346395875,14.567070881728819,,,,26.400000000000002,4.997900466750061,23.400000000000002,6.936137056613722,failed: ZeroDivisionError,0.06958740000845864,,7840,,,0.46344829999725334,0.17342690055374987,0.29002139944350347,22.12077813185585
model_regularization_sweep_no_presmoothing,nonlinear_no_noise,materngpmonotone_unregularized+ridge=1e-6,3000,289,17,17,1,none,0.0,ridge,1e-06,0.0005244856220187943,0.00031447170094684444,0.0028460036004887244,0.0031163394924019804,,,,0.0,0.0,0.0,0.0,failed: RuntimeError,0.6428714000212494,,12320,,,3.0903505999885965,2.5389682984387036,0.5513823015498929,206.08508915898568
model_regularization_sweep_no_presmoothing,nonlinear_no_noise,materngpmonotone_unregularized+ridge=1e-4,3000,289,17,17,1,none,0.0,ridge,0.0001,0.0005244835647130028,0.00031446998360200085,0.0028460087779753848,0.0031163423433651534,,,,0.0,0.0,0.0,0.0,failed: RuntimeError,0.6148490000050515,,8960,,,2.23512669999036,1.83741350096534,0.39771319902502,205.0684710898817
model_regularization_sweep_no_presmoothing,nonlinear_no_noise,materngpmonotone_unregularized+ridge=1e-2,3000,289,17,17,1,none,0.0,ridge,0.01,0.0005245417412257471,0.00031451432611416313,0.002846526617248496,0.0031166277804693756,,,,0.0,0.0,0.0,0.0,failed: RuntimeError,0.6254050999996252,,14800,,,3.7222955000179354,3.057348101079697,0.6649473989382386,206.5775743972768
model_regularization_sweep_no_presmoothing,nonlinear_no_noise,materngpmonotone_unregularized+ridge=1e-1,3000,289,17,17,1,none,0.0,ridge,0.1,0.0005250750170549842,0.0003149067436194927,0.0028512417519887677,0.0031192236237356534,,,,0.0,0.0,0.0,0.0,failed: RuntimeError,0.615103399992222,,6800,,,1.6916008999978658,1.3916273012873717,0.2999735987104941,204.65107371873114
model_regularization_sweep_no_presmoothing,nonlinear_no_noise,mlp+ridge=1e-6,3000,289,17,17,1,none,0.0,ridge,1e-06,0.35777289468682855,0.3573011211741793,1.2080112007460646,1.4149524456188958,,,,1.2,0.02391251995689877,0.2,0.24790706792389727,ok,4.12310840000282,4.0,720,4.458841437395206e-14,0.015707873470282057,6.716076200013049,6.662369099765783,0.05370710024726577,9253.290416341366
model_regularization_sweep_no_presmoothing,nonlinear_no_noise,mlp+ridge=1e-4,3000,289,17,17,1,none,0.0,ridge,0.0001,0.358266432900965,0.3578053118630471,1.2088386665151374,1.4150054706188624,,,,1.2,0.023853107658513884,0.2,0.2455758880455867,ok,4.133778999996139,4.0,720,6.483550376681334e-14,0.015703315359223056,13.074396899988642,12.962756300577894,0.11164059941074811,18003.828195247075
model_regularization_sweep_no_presmoothing,nonlinear_no_noise,mlp+ridge=1e-2,3000,289,17,17,1,none,0.0,ridge,0.01,0.40829858502936167,0.41023558236997726,1.2945515986156564,1.4297338442364214,,,,1.4000000000000001,0.01734174608364018,0.0,0.0,ok,8.195023099979153,4.0,720,5.3538080831502974e-14,0.015216717068971129,6.798408900009235,6.741612000099849,0.05679689990938641,9363.350000138678
model_regularization_sweep_no_presmoothing,nonlinear_no_noise,mlp+ridge=1e-1,3000,289,17,17,1,none,0.0,ridge,0.1,0.6495101130955189,0.7262196493464306,1.7582986566593022,1.856683384025514,,,,0.8,0.0015187823784719985,0.0,0.0,ok,4.108905300003244,4.0,720,5.1787352341330745e-14,0.028647349245643307,6.890229200012982,6.837000699888449,0.05322850012453273,9495.834305400624

Results/paper_grouped_results/02_no_noise_no_smoothing_baselines/no_noise_no_smoothing_tables.md

## Nonlinear (No-noise)

\begin{table}[h]
\centering
\scriptsize
\caption{Nonlinear (No-noise) Data Accuracy}
\resizebox{\linewidth}{!}{%
\begin{tabular}{lcccccc}
\toprule
method & q RMSE & q/noise & $q_s$ RMSE & $q_s$/noise & $q_T$ RMSE & $q_T$/noise \\
\midrule
Analytic         & 1.2962e-15 & -- & 0.0000e+00 & -- & 0.0000e+00 & -- \\
MLP              & 3.5777e-01 & -- & 1.2080e+00 & -- & 1.4150e+00 & -- \\
KISS-GP          & 3.1269e-01 & -- & 1.0137e+00 & -- & 8.9430e-01 & -- \\
SavGol           & 1.0844e-02 & -- & 1.1573e-01 & -- & 3.7609e-02 & -- \\
CubicSpline      & 7.8880e-01 & -- & 2.5036e+00 & -- & 4.5857e+00 & -- \\
PCHIP            & -- & -- & -- & -- & -- & -- \\
FiniteDiff       & 7.0599e-01 & -- & 9.4205e-01 & -- & 1.4498e+00 & -- \\
RBF              & 2.7494e+00 & -- & 5.0420e+00 & -- & 9.1676e+00 & -- \\
\bottomrule
\end{tabular}%
}
\end{table}

\begin{table}[h]
\centering
\scriptsize
\caption{Nonlinear (No-noise) Data Physical Correctness}
\resizebox{\linewidth}{!}{%
\begin{tabular}{lcccc}
\toprule
method & entropy\_violation\_\% & worst\_entropy\_violation & deriv\_violation\_\% & worst\_deriv\_violation \\
\midrule
Analytic         & 0.0000e+00 & 0.0000e+00 & 0.0000e+00 & 0.0000e+00 \\
MLP              & 1.2000e+00 & 2.3913e-02 & 2.0000e-01 & 2.4793e-01 \\
KISS-GP          & 0.0000e+00 & 0.0000e+00 & 0.0000e+00 & 0.0000e+00 \\
SavGol           & 0.0000e+00 & 0.0000e+00 & 0.0000e+00 & 0.0000e+00 \\
CubicSpline      & 1.8000e+00 & 1.0735e-01 & 3.0000e+00 & 7.6152e+00 \\
PCHIP            & 1.8000e+00 & 1.1290e-01 & 0.0000e+00 & 0.0000e+00 \\
FiniteDiff       & 1.6000e+00 & 7.6708e-02 & 0.0000e+00 & 0.0000e+00 \\
RBF              & 2.5000e+01 & 2.6888e+00 & 2.7600e+01 & 6.8628e+00 \\
\bottomrule
\end{tabular}%
}
\end{table}